{
 "config_version": "1.0",
 "source_id": "asic-company-dataset-7b8656f9",
 "generated_by": {
  "agent_version": "0.1",
  "model": "gemini-3.7-flash",
  "generated_at": ""
 },
 "resource": {
  "url": "https://data.gov.au/data/dataset/7b8656f9-606d-4337-af29-66b89b2eeefb/resource/5c3914e6-413e-4a2c-b890-bf8efe3eabf2/download/company_202609.csv",
  "catalogue_format": "CSV",
  "real_format": "TSV",
  "encoding": "utf-8",
  "header_row": 0,
  "delimiter": "\t"
 },
 "record_id": {
  "strategy": "hash_of_fields",
  "fields": [
   "ACN",
   "Company Name"
  ],
  "note": "ACN alone is not unique because the dataset includes historical name records per company."
 },
 "observation": {
  "licence": "Creative Commons Attribution 3.0 Australia",
  "source_reliability": 0.98,
  "observed_at": {
   "from_field": "",
   "formats": [],
   "note": "No observation timestamp is present in the source records.",
   "fallback_constant": "2026-09-14T15:25:32.406572",
   "fallback_source": "dataset metadata_modified from CKAN"
  },
  "valid_from": {
   "from_field": "Date of Registration",
   "formats": [
    "%d/%m/%Y"
   ],
   "note": "Registration date indicates the start of the entity record validity."
  },
  "valid_to": {
   "from_field": "Date of Deregistration",
   "formats": [
    "%d/%m/%Y"
   ],
   "note": "Deregistration date marks the end of active company validity."
  }
 },
 "field_mappings": [
  {
   "canonical_field": "entity.legal_name",
   "source_field": "Company Name",
   "transforms": [
    {
     "op": "coalesce",
     "fields": [
      "Current Name",
      "Company Name"
     ]
    },
    {
     "op": "strip"
    },
    {
     "op": "collapse_spaces"
    }
   ],
   "field_confidence": 0.95,
   "note": "Primary registered entity legal name, preferring Current Name if present."
  },
  {
   "canonical_field": "entity.acn",
   "source_field": "ACN",
   "transforms": [
    {
     "op": "acn_normalize"
    }
   ],
   "field_confidence": 1.0,
   "note": "Australian Company Number validated with checksum."
  },
  {
   "canonical_field": "entity.abn",
   "source_field": "ABN",
   "transforms": [
    {
     "op": "null_if",
     "values": [
      "0"
     ]
    },
    {
     "op": "abn_normalize"
    }
   ],
   "field_confidence": 0.95,
   "note": "Australian Business Number validated with checksum."
  },
  {
   "canonical_field": "entity.entity_type",
   "source_field": "Type",
   "transforms": [
    {
     "op": "map_values",
     "mapping": {
      "APTY": "company",
      "APUB": "company",
      "FNOS": "company"
     },
     "default": "unknown"
    }
   ],
   "field_confidence": 0.95,
   "note": "Maps ASIC company types (APTY, APUB, FNOS) to canonical entity_type."
  },
  {
   "canonical_field": "entity.status",
   "source_field": "Status",
   "transforms": [
    {
     "op": "map_values",
     "mapping": {
      "REGD": "active",
      "DRGD": "deregistered",
      "EXAD": "in_liquidation",
      "SOFF": "in_liquidation"
     },
     "default": "unknown"
    }
   ],
   "field_confidence": 0.95,
   "note": "Maps ASIC company status codes including strike-off action (SOFF) to canonical status."
  },
  {
   "canonical_field": "entity.date_registered",
   "source_field": "Date of Registration",
   "transforms": [
    {
     "op": "parse_date",
     "formats": [
      "%d/%m/%Y"
     ]
    }
   ],
   "field_confidence": 0.95,
   "note": "Registration date parsed to ISO format."
  }
 ],
 "unmapped_source_fields": [
  {
   "source_field": "Class",
   "reason": "Internal ASIC company structure classification not represented in canonical ontology."
  },
  {
   "source_field": "Sub Class",
   "reason": "Internal ASIC company structure sub-classification not represented in canonical ontology."
  },
  {
   "source_field": "Previous State of Registration",
   "reason": "Refers to historical state corporate registry, not physical or registered business address state."
  },
  {
   "source_field": "State Registration number",
   "reason": "Historical pre-ACN state registration identifier."
  },
  {
   "source_field": "Modified since last report",
   "reason": "Empty dataset export change-tracking flag."
  },
  {
   "source_field": "Current Name Indicator",
   "reason": "Indicator flag distinguishing current vs previous names, not a canonical field."
  },
  {
   "source_field": "Current Name Start Date",
   "reason": "Effective date of current name change, not represented in canonical ontology."
  }
 ],
 "unfilled_canonical_fields": [
  {
   "canonical_field": "entity.trading_name",
   "reason": "Source only contains registered corporate legal names, not trading names."
  },
  {
   "canonical_field": "entity.nzbn",
   "reason": "Dataset covers Australian entities; New Zealand Business Number is not applicable."
  },
  {
   "canonical_field": "entity.website",
   "reason": "Entity website URL is not captured in this ASIC registry dataset."
  },
  {
   "canonical_field": "entity.industry_code",
   "reason": "Industry/ANZSIC classification codes are not provided in this extract."
  },
  {
   "canonical_field": "address.full",
   "reason": "No address fields are present in this dataset."
  },
  {
   "canonical_field": "address.locality",
   "reason": "No locality data is present in this dataset."
  },
  {
   "canonical_field": "address.state",
   "reason": "Only historical state of registration is present, not entity address state."
  },
  {
   "canonical_field": "address.postcode",
   "reason": "No postcode data is present in this dataset."
  },
  {
   "canonical_field": "address.country",
   "reason": "No country address data is present in this dataset."
  }
 ]
}